{
  "tramos": [
    {"codigo": "LUN-1", "diaSemana": 1, "ordenEnDia": 1},
    {"codigo": "LUN-2", "diaSemana": 1, "ordenEnDia": 2},
    {"codigo": "LUN-3", "diaSemana": 1, "ordenEnDia": 3},
    {"codigo": "LUN-4", "diaSemana": 1, "ordenEnDia": 4}
  ],
  "aulas": [ {"codigo": "A5", "nombre": "Aula 5"} ],
  "asignaturas": [
    {"codigo": "Mat", "nombre": "Matematicas"},
    {"codigo": "LCL", "nombre": "Lengua Castellana y Literatura"},
    {"codigo": "Ing", "nombre": "Ingles"}
  ],
  "profesores": [
    {"codigo": "MAT8", "nombre": "Profesor Matematicas 8"},
    {"codigo": "LEN2", "nombre": "Profesor Lengua 2"},
    {"codigo": "LEN8", "nombre": "Profesor Lengua 8"},
    {"codigo": "ING4", "nombre": "Profesor Ingles 4"}
  ],
  "grupos": [ {"codigo": "1A", "tipo": "ORDINARIO", "grupoPadre": null} ],
  "subgrupos": [ {"codigo": "1A-Completo", "grupos": ["1A"]} ],
  "actividades": [
    {
      "codigo": "Mat-1A", "asignatura": "Mat",
      "repeticionesPorSemana": 4, "duracionTramos": 1, "patronTemporal": "DISTRIBUIDA",
      "plazas": [ {"codigo": "Mat-1A-P1", "asignatura": "Mat", "profesores": ["MAT8"],
        "aulaFija": "A5", "subgrupos": ["1A-Completo"]} ]
    },
    {
      "codigo": "Ing-1A", "asignatura": "Ing",
      "repeticionesPorSemana": 3, "duracionTramos": 1, "patronTemporal": "DISTRIBUIDA",
      "plazas": [ {"codigo": "Ing-1A-P1", "asignatura": "Ing", "profesores": ["ING4"],
        "aulaFija": "A5", "subgrupos": ["1A-Completo"]} ]
    },
    {
      "codigo": "LCL-1A", "asignatura": "LCL",
      "repeticionesPorSemana": 4, "duracionTramos": 1, "patronTemporal": "DISTRIBUIDA",
      "plazas": [ {"codigo": "LCL-1A-P1", "asignatura": "LCL", "profesores": ["LEN2", "LEN8"],
        "aulaFija": "A5", "subgrupos": ["1A-Completo"]} ]
    }
  ]
}