{
  "tramos": [
    {
      "codigo": "D1-1",
      "diaSemana": 1,
      "ordenEnDia": 1
    }
  ],
  "aulas": [
    {
      "codigo": "A01",
      "nombre": "Aula A01"
    },
    {
      "codigo": "A02",
      "nombre": "Aula A02"
    },
    {
      "codigo": "A03",
      "nombre": "Aula A03"
    },
    {
      "codigo": "A04",
      "nombre": "Aula A04"
    },
    {
      "codigo": "A05",
      "nombre": "Aula A05"
    },
    {
      "codigo": "A06",
      "nombre": "Aula A06"
    },
    {
      "codigo": "A07",
      "nombre": "Aula A07"
    },
    {
      "codigo": "A08",
      "nombre": "Aula A08"
    },
    {
      "codigo": "A09",
      "nombre": "Aula A09"
    },
    {
      "codigo": "A10",
      "nombre": "Aula A10"
    },
    {
      "codigo": "A11",
      "nombre": "Aula A11"
    },
    {
      "codigo": "A12",
      "nombre": "Aula A12"
    }
  ],
  "asignaturas": [
    {
      "codigo": "GEN",
      "nombre": "Generica"
    }
  ],
  "profesores": [
    {
      "codigo": "P1",
      "nombre": "Prof 1"
    },
    {
      "codigo": "P2",
      "nombre": "Prof 2"
    }
  ],
  "grupos": [
    {
      "codigo": "G1",
      "tipo": "ORDINARIO",
      "grupoPadre": null
    },
    {
      "codigo": "G2",
      "tipo": "ORDINARIO",
      "grupoPadre": null
    }
  ],
  "subgrupos": [
    {
      "codigo": "SG1",
      "grupos": [
        "G1"
      ]
    },
    {
      "codigo": "SG2",
      "grupos": [
        "G2"
      ]
    }
  ],
  "actividades": [
    {
      "codigo": "ActPodada",
      "asignatura": null,
      "repeticionesPorSemana": 1,
      "duracionTramos": 1,
      "patronTemporal": "NEUTRA",
      "plazas": [
        {
          "codigo": "ActPodada-P",
          "asignatura": "GEN",
          "profesores": [
            "P1"
          ],
          "subgrupos": [
            "SG1"
          ],
          "aulasCandidatas": [
            "A01",
            "A02",
            "A03",
            "A04",
            "A05",
            "A06",
            "A07",
            "A08",
            "A09",
            "A10",
            "A11",
            "A12"
          ]
        }
      ]
    },
    {
      "codigo": "ActFija",
      "asignatura": null,
      "repeticionesPorSemana": 1,
      "duracionTramos": 1,
      "patronTemporal": "NEUTRA",
      "plazas": [
        {
          "codigo": "ActFija-P",
          "asignatura": "GEN",
          "profesores": [
            "P2"
          ],
          "subgrupos": [
            "SG2"
          ],
          "aulaFija": "A01"
        }
      ]
    }
  ]
}