{
  "tramos": [
    {"codigo":"LUN-1","diaSemana":1,"ordenEnDia":1},
    {"codigo":"LUN-2","diaSemana":1,"ordenEnDia":2}
  ],
  "aulas": [{"codigo":"A5","nombre":"Aula 5"},{"codigo":"A6","nombre":"Aula 6"}],
  "asignaturas": [{"codigo":"Mat","nombre":"Matematicas"}],
  "profesores": [{"codigo":"MAT8","nombre":"P8"},{"codigo":"MAT9","nombre":"P9"}],
  "grupos": [{"codigo":"1A","tipo":"ORDINARIO"}],
  "subgrupos": [{"codigo":"S1","grupos":["1A"]},{"codigo":"S2","grupos":["1A"]}],
  "actividades": [
    {"codigo":"D","asignatura":"Mat","repeticionesPorSemana":1,"duracionTramos":1,
     "patronTemporal":"NEUTRA","plazas":[
       {"codigo":"P1","asignatura":"Mat","profesores":["MAT8"],"aulasCandidatas":["A5","A6"],"subgrupos":["S1"]},
       {"codigo":"P2","asignatura":"Mat","profesores":["MAT9"],"aulasCandidatas":["A5","A6"],"subgrupos":["S2"]}]}
  ],
  "bloqueos": [{"actividad":"D","indice":1,"tramo":"LUN-1",
    "aulasPinadas":[{"plaza":"P1","aula":"A5"},{"plaza":"P2","aula":"A6"}]}]
}
