{
  "tramos": [
    {
      "codigo": "D1-1",
      "diaSemana": 1,
      "ordenEnDia": 1
    }
  ],
  "aulas": [
    {
      "codigo": "A01",
      "nombre": "Aula A01"
    },
    {
      "codigo": "A02",
      "nombre": "Aula A02"
    },
    {
      "codigo": "A03",
      "nombre": "Aula A03"
    },
    {
      "codigo": "A04",
      "nombre": "Aula A04"
    },
    {
      "codigo": "A05",
      "nombre": "Aula A05"
    },
    {
      "codigo": "A06",
      "nombre": "Aula A06"
    },
    {
      "codigo": "A07",
      "nombre": "Aula A07"
    },
    {
      "codigo": "A08",
      "nombre": "Aula A08"
    },
    {
      "codigo": "A09",
      "nombre": "Aula A09"
    },
    {
      "codigo": "A10",
      "nombre": "Aula A10"
    },
    {
      "codigo": "A11",
      "nombre": "Aula A11"
    },
    {
      "codigo": "A12",
      "nombre": "Aula A12"
    }
  ],
  "asignaturas": [
    {
      "codigo": "GEN",
      "nombre": "Generica"
    }
  ],
  "profesores": [
    {
      "codigo": "P1",
      "nombre": "Prof 1"
    },
    {
      "codigo": "P2",
      "nombre": "Prof 2"
    },
    {
      "codigo": "P3",
      "nombre": "Prof 3"
    },
    {
      "codigo": "P4",
      "nombre": "Prof 4"
    },
    {
      "codigo": "P5",
      "nombre": "Prof 5"
    },
    {
      "codigo": "P6",
      "nombre": "Prof 6"
    },
    {
      "codigo": "P7",
      "nombre": "Prof 7"
    },
    {
      "codigo": "P8",
      "nombre": "Prof 8"
    },
    {
      "codigo": "P9",
      "nombre": "Prof 9"
    }
  ],
  "grupos": [
    {
      "codigo": "G1",
      "tipo": "ORDINARIO",
      "grupoPadre": null
    },
    {
      "codigo": "G2",
      "tipo": "ORDINARIO",
      "grupoPadre": null
    },
    {
      "codigo": "G3",
      "tipo": "ORDINARIO",
      "grupoPadre": null
    },
    {
      "codigo": "G4",
      "tipo": "ORDINARIO",
      "grupoPadre": null
    },
    {
      "codigo": "G5",
      "tipo": "ORDINARIO",
      "grupoPadre": null
    },
    {
      "codigo": "G6",
      "tipo": "ORDINARIO",
      "grupoPadre": null
    },
    {
      "codigo": "G7",
      "tipo": "ORDINARIO",
      "grupoPadre": null
    },
    {
      "codigo": "G8",
      "tipo": "ORDINARIO",
      "grupoPadre": null
    },
    {
      "codigo": "G9",
      "tipo": "ORDINARIO",
      "grupoPadre": null
    }
  ],
  "subgrupos": [
    {
      "codigo": "SG1",
      "grupos": [
        "G1"
      ]
    },
    {
      "codigo": "SG2",
      "grupos": [
        "G2"
      ]
    },
    {
      "codigo": "SG3",
      "grupos": [
        "G3"
      ]
    },
    {
      "codigo": "SG4",
      "grupos": [
        "G4"
      ]
    },
    {
      "codigo": "SG5",
      "grupos": [
        "G5"
      ]
    },
    {
      "codigo": "SG6",
      "grupos": [
        "G6"
      ]
    },
    {
      "codigo": "SG7",
      "grupos": [
        "G7"
      ]
    },
    {
      "codigo": "SG8",
      "grupos": [
        "G8"
      ]
    },
    {
      "codigo": "SG9",
      "grupos": [
        "G9"
      ]
    }
  ],
  "actividades": [
    {
      "codigo": "Act1",
      "asignatura": null,
      "repeticionesPorSemana": 1,
      "duracionTramos": 1,
      "patronTemporal": "NEUTRA",
      "plazas": [
        {
          "codigo": "Act1-P",
          "asignatura": "GEN",
          "profesores": [
            "P1"
          ],
          "subgrupos": [
            "SG1"
          ],
          "aulasCandidatas": [
            "A01",
            "A02",
            "A03",
            "A04",
            "A05",
            "A06",
            "A07",
            "A08",
            "A09",
            "A10",
            "A11",
            "A12"
          ]
        }
      ]
    },
    {
      "codigo": "Act2",
      "asignatura": null,
      "repeticionesPorSemana": 1,
      "duracionTramos": 1,
      "patronTemporal": "NEUTRA",
      "plazas": [
        {
          "codigo": "Act2-P",
          "asignatura": "GEN",
          "profesores": [
            "P2"
          ],
          "subgrupos": [
            "SG2"
          ],
          "aulasCandidatas": [
            "A01",
            "A02",
            "A03",
            "A04",
            "A05",
            "A06",
            "A07",
            "A08",
            "A09",
            "A10",
            "A11",
            "A12"
          ]
        }
      ]
    },
    {
      "codigo": "Act3",
      "asignatura": null,
      "repeticionesPorSemana": 1,
      "duracionTramos": 1,
      "patronTemporal": "NEUTRA",
      "plazas": [
        {
          "codigo": "Act3-P",
          "asignatura": "GEN",
          "profesores": [
            "P3"
          ],
          "subgrupos": [
            "SG3"
          ],
          "aulasCandidatas": [
            "A01",
            "A02",
            "A03",
            "A04",
            "A05",
            "A06",
            "A07",
            "A08",
            "A09",
            "A10",
            "A11",
            "A12"
          ]
        }
      ]
    },
    {
      "codigo": "Act4",
      "asignatura": null,
      "repeticionesPorSemana": 1,
      "duracionTramos": 1,
      "patronTemporal": "NEUTRA",
      "plazas": [
        {
          "codigo": "Act4-P",
          "asignatura": "GEN",
          "profesores": [
            "P4"
          ],
          "subgrupos": [
            "SG4"
          ],
          "aulasCandidatas": [
            "A01",
            "A02",
            "A03",
            "A04",
            "A05",
            "A06",
            "A07",
            "A08",
            "A09",
            "A10",
            "A11",
            "A12"
          ]
        }
      ]
    },
    {
      "codigo": "Act5",
      "asignatura": null,
      "repeticionesPorSemana": 1,
      "duracionTramos": 1,
      "patronTemporal": "NEUTRA",
      "plazas": [
        {
          "codigo": "Act5-P",
          "asignatura": "GEN",
          "profesores": [
            "P5"
          ],
          "subgrupos": [
            "SG5"
          ],
          "aulasCandidatas": [
            "A01",
            "A02",
            "A03",
            "A04",
            "A05",
            "A06",
            "A07",
            "A08",
            "A09",
            "A10",
            "A11",
            "A12"
          ]
        }
      ]
    },
    {
      "codigo": "Act6",
      "asignatura": null,
      "repeticionesPorSemana": 1,
      "duracionTramos": 1,
      "patronTemporal": "NEUTRA",
      "plazas": [
        {
          "codigo": "Act6-P",
          "asignatura": "GEN",
          "profesores": [
            "P6"
          ],
          "subgrupos": [
            "SG6"
          ],
          "aulasCandidatas": [
            "A01",
            "A02",
            "A03",
            "A04",
            "A05",
            "A06",
            "A07",
            "A08",
            "A09",
            "A10",
            "A11",
            "A12"
          ]
        }
      ]
    },
    {
      "codigo": "Act7",
      "asignatura": null,
      "repeticionesPorSemana": 1,
      "duracionTramos": 1,
      "patronTemporal": "NEUTRA",
      "plazas": [
        {
          "codigo": "Act7-P",
          "asignatura": "GEN",
          "profesores": [
            "P7"
          ],
          "subgrupos": [
            "SG7"
          ],
          "aulasCandidatas": [
            "A01",
            "A02",
            "A03",
            "A04",
            "A05",
            "A06",
            "A07",
            "A08",
            "A09",
            "A10",
            "A11",
            "A12"
          ]
        }
      ]
    },
    {
      "codigo": "Act8",
      "asignatura": null,
      "repeticionesPorSemana": 1,
      "duracionTramos": 1,
      "patronTemporal": "NEUTRA",
      "plazas": [
        {
          "codigo": "Act8-P",
          "asignatura": "GEN",
          "profesores": [
            "P8"
          ],
          "subgrupos": [
            "SG8"
          ],
          "aulasCandidatas": [
            "A01",
            "A02",
            "A03",
            "A04",
            "A05",
            "A06",
            "A07",
            "A08",
            "A09",
            "A10",
            "A11",
            "A12"
          ]
        }
      ]
    },
    {
      "codigo": "Act9",
      "asignatura": null,
      "repeticionesPorSemana": 1,
      "duracionTramos": 1,
      "patronTemporal": "NEUTRA",
      "plazas": [
        {
          "codigo": "Act9-P",
          "asignatura": "GEN",
          "profesores": [
            "P9"
          ],
          "subgrupos": [
            "SG9"
          ],
          "aulasCandidatas": [
            "A01",
            "A02",
            "A03",
            "A04",
            "A05",
            "A06",
            "A07",
            "A08",
            "A09",
            "A10",
            "A11",
            "A12"
          ]
        }
      ]
    }
  ]
}