{
  "tramos": [
    {
      "codigo": "L1",
      "diaSemana": 1,
      "ordenEnDia": 1
    },
    {
      "codigo": "L2",
      "diaSemana": 1,
      "ordenEnDia": 2
    },
    {
      "codigo": "L3",
      "diaSemana": 1,
      "ordenEnDia": 3
    },
    {
      "codigo": "L4",
      "diaSemana": 1,
      "ordenEnDia": 4
    },
    {
      "codigo": "L5",
      "diaSemana": 1,
      "ordenEnDia": 5
    },
    {
      "codigo": "L6",
      "diaSemana": 1,
      "ordenEnDia": 6
    },
    {
      "codigo": "M1",
      "diaSemana": 2,
      "ordenEnDia": 1
    },
    {
      "codigo": "M2",
      "diaSemana": 2,
      "ordenEnDia": 2
    },
    {
      "codigo": "M3",
      "diaSemana": 2,
      "ordenEnDia": 3
    },
    {
      "codigo": "M4",
      "diaSemana": 2,
      "ordenEnDia": 4
    },
    {
      "codigo": "M5",
      "diaSemana": 2,
      "ordenEnDia": 5
    },
    {
      "codigo": "M6",
      "diaSemana": 2,
      "ordenEnDia": 6
    },
    {
      "codigo": "X1",
      "diaSemana": 3,
      "ordenEnDia": 1
    },
    {
      "codigo": "X2",
      "diaSemana": 3,
      "ordenEnDia": 2
    },
    {
      "codigo": "X3",
      "diaSemana": 3,
      "ordenEnDia": 3
    },
    {
      "codigo": "X4",
      "diaSemana": 3,
      "ordenEnDia": 4
    },
    {
      "codigo": "X5",
      "diaSemana": 3,
      "ordenEnDia": 5
    },
    {
      "codigo": "X6",
      "diaSemana": 3,
      "ordenEnDia": 6
    },
    {
      "codigo": "J1",
      "diaSemana": 4,
      "ordenEnDia": 1
    },
    {
      "codigo": "J2",
      "diaSemana": 4,
      "ordenEnDia": 2
    },
    {
      "codigo": "J3",
      "diaSemana": 4,
      "ordenEnDia": 3
    },
    {
      "codigo": "J4",
      "diaSemana": 4,
      "ordenEnDia": 4
    },
    {
      "codigo": "J5",
      "diaSemana": 4,
      "ordenEnDia": 5
    },
    {
      "codigo": "J6",
      "diaSemana": 4,
      "ordenEnDia": 6
    },
    {
      "codigo": "V1",
      "diaSemana": 5,
      "ordenEnDia": 1
    },
    {
      "codigo": "V2",
      "diaSemana": 5,
      "ordenEnDia": 2
    },
    {
      "codigo": "V3",
      "diaSemana": 5,
      "ordenEnDia": 3
    },
    {
      "codigo": "V4",
      "diaSemana": 5,
      "ordenEnDia": 4
    },
    {
      "codigo": "V5",
      "diaSemana": 5,
      "ordenEnDia": 5
    },
    {
      "codigo": "V6",
      "diaSemana": 5,
      "ordenEnDia": 6
    }
  ],
  "aulas": [
    {
      "codigo": "TALL3",
      "nombre": "Taller 3 (aula teorica CS para FPB)"
    },
    {
      "codigo": "TALL_FPB",
      "nombre": "Taller tecnico FPB (no listado por aula, Hallazgo H)"
    }
  ],
  "asignaturas": [
    {
      "codigo": "CA",
      "nombre": "Ciencias Aplicadas"
    },
    {
      "codigo": "AMO",
      "nombre": "Amovibles"
    },
    {
      "codigo": "CS",
      "nombre": "Comunicacion y Sociedad"
    },
    {
      "codigo": "IPE",
      "nombre": "Itinerario Personal para la Empleabilidad"
    },
    {
      "codigo": "MECSO",
      "nombre": "Mecanizado y Soldadura"
    },
    {
      "codigo": "PS",
      "nombre": "Preparacion de Superficies"
    },
    {
      "codigo": "Tut",
      "nombre": "Tutoria"
    }
  ],
  "profesores": [
    {
      "codigo": "PAU2",
      "nombre": "Millan Erencia, Antonio"
    },
    {
      "codigo": "TEC1",
      "nombre": "Profesor TEC1"
    },
    {
      "codigo": "FOL3",
      "nombre": "Profesor FOL3"
    },
    {
      "codigo": "GH1",
      "nombre": "Profesor GH1"
    }
  ],
  "grupos": [
    {
      "codigo": "1FPB",
      "tipo": "ORDINARIO",
      "grupoPadre": null
    }
  ],
  "subgrupos": [
    {
      "codigo": "1FPB-Completo",
      "grupos": [
        "1FPB"
      ]
    }
  ],
  "actividades": [
    {
      "codigo": "CA-1FPB-blk",
      "asignatura": "CA",
      "repeticionesPorSemana": 2,
      "duracionTramos": 2,
      "patronTemporal": "NEUTRA",
      "plazas": [
        {
          "codigo": "CA-1FPB-blk-pl",
          "asignatura": "CA",
          "profesores": [
            "TEC1"
          ],
          "subgrupos": [
            "1FPB-Completo"
          ],
          "aulaFija": "TALL_FPB"
        }
      ]
    },
    {
      "codigo": "AMO-1FPB-blk",
      "asignatura": "AMO",
      "repeticionesPorSemana": 3,
      "duracionTramos": 2,
      "patronTemporal": "NEUTRA",
      "plazas": [
        {
          "codigo": "AMO-1FPB-blk-pl",
          "asignatura": "AMO",
          "profesores": [
            "PAU2"
          ],
          "subgrupos": [
            "1FPB-Completo"
          ],
          "aulaFija": "TALL_FPB"
        }
      ]
    },
    {
      "codigo": "CS-1FPB-blk",
      "asignatura": "CS",
      "repeticionesPorSemana": 1,
      "duracionTramos": 2,
      "patronTemporal": "NEUTRA",
      "plazas": [
        {
          "codigo": "CS-1FPB-blk-pl",
          "asignatura": "CS",
          "profesores": [
            "GH1"
          ],
          "subgrupos": [
            "1FPB-Completo"
          ],
          "aulaFija": "TALL3"
        }
      ]
    },
    {
      "codigo": "IPE-1FPB-blk",
      "asignatura": "IPE",
      "repeticionesPorSemana": 1,
      "duracionTramos": 2,
      "patronTemporal": "NEUTRA",
      "plazas": [
        {
          "codigo": "IPE-1FPB-blk-pl",
          "asignatura": "IPE",
          "profesores": [
            "FOL3"
          ],
          "subgrupos": [
            "1FPB-Completo"
          ],
          "aulaFija": "TALL_FPB"
        }
      ]
    },
    {
      "codigo": "MECSO-1FPB-blk2",
      "asignatura": "MECSO",
      "repeticionesPorSemana": 1,
      "duracionTramos": 2,
      "patronTemporal": "NEUTRA",
      "plazas": [
        {
          "codigo": "MECSO-1FPB-blk2-pl",
          "asignatura": "MECSO",
          "profesores": [
            "PAU2"
          ],
          "subgrupos": [
            "1FPB-Completo"
          ],
          "aulaFija": "TALL_FPB"
        }
      ]
    },
    {
      "codigo": "MECSO-1FPB-blk3",
      "asignatura": "MECSO",
      "repeticionesPorSemana": 1,
      "duracionTramos": 3,
      "patronTemporal": "NEUTRA",
      "plazas": [
        {
          "codigo": "MECSO-1FPB-blk3-pl",
          "asignatura": "MECSO",
          "profesores": [
            "PAU2"
          ],
          "subgrupos": [
            "1FPB-Completo"
          ],
          "aulaFija": "TALL_FPB"
        }
      ]
    },
    {
      "codigo": "PS-1FPB-blk3",
      "asignatura": "PS",
      "repeticionesPorSemana": 1,
      "duracionTramos": 3,
      "patronTemporal": "NEUTRA",
      "plazas": [
        {
          "codigo": "PS-1FPB-blk3-pl",
          "asignatura": "PS",
          "profesores": [
            "PAU2"
          ],
          "subgrupos": [
            "1FPB-Completo"
          ],
          "aulaFija": "TALL_FPB"
        }
      ]
    },
    {
      "codigo": "CS-1FPB-suelta",
      "asignatura": "CS",
      "repeticionesPorSemana": 4,
      "duracionTramos": 1,
      "patronTemporal": "NEUTRA",
      "plazas": [
        {
          "codigo": "CS-1FPB-suelta-pl",
          "asignatura": "CS",
          "profesores": [
            "GH1"
          ],
          "subgrupos": [
            "1FPB-Completo"
          ],
          "aulaFija": "TALL3"
        }
      ]
    },
    {
      "codigo": "PS-1FPB-suelta",
      "asignatura": "PS",
      "repeticionesPorSemana": 2,
      "duracionTramos": 1,
      "patronTemporal": "NEUTRA",
      "plazas": [
        {
          "codigo": "PS-1FPB-suelta-pl",
          "asignatura": "PS",
          "profesores": [
            "PAU2"
          ],
          "subgrupos": [
            "1FPB-Completo"
          ],
          "aulaFija": "TALL_FPB"
        }
      ]
    },
    {
      "codigo": "IPE-1FPB-suelta",
      "asignatura": "IPE",
      "repeticionesPorSemana": 1,
      "duracionTramos": 1,
      "patronTemporal": "NEUTRA",
      "plazas": [
        {
          "codigo": "IPE-1FPB-suelta-pl",
          "asignatura": "IPE",
          "profesores": [
            "FOL3"
          ],
          "subgrupos": [
            "1FPB-Completo"
          ],
          "aulaFija": "TALL_FPB"
        }
      ]
    },
    {
      "codigo": "Tut-1FPB",
      "asignatura": "Tut",
      "repeticionesPorSemana": 1,
      "duracionTramos": 1,
      "patronTemporal": "NEUTRA",
      "plazas": [
        {
          "codigo": "Tut-1FPB-pl",
          "asignatura": "Tut",
          "profesores": [
            "PAU2"
          ],
          "subgrupos": [
            "1FPB-Completo"
          ],
          "aulaFija": "TALL_FPB"
        }
      ]
    }
  ]
}