{
  "tramos": [
    {"codigo": "L1", "diaSemana": 1, "ordenEnDia": 1},
    {"codigo": "L2", "diaSemana": 1, "ordenEnDia": 2},
    {"codigo": "L3", "diaSemana": 1, "ordenEnDia": 3},
    {"codigo": "L4", "diaSemana": 1, "ordenEnDia": 4},
    {"codigo": "L5", "diaSemana": 1, "ordenEnDia": 5},
    {"codigo": "L6", "diaSemana": 1, "ordenEnDia": 6},
    {"codigo": "M1", "diaSemana": 2, "ordenEnDia": 1},
    {"codigo": "M2", "diaSemana": 2, "ordenEnDia": 2},
    {"codigo": "M3", "diaSemana": 2, "ordenEnDia": 3},
    {"codigo": "M4", "diaSemana": 2, "ordenEnDia": 4},
    {"codigo": "M5", "diaSemana": 2, "ordenEnDia": 5},
    {"codigo": "M6", "diaSemana": 2, "ordenEnDia": 6},
    {"codigo": "X1", "diaSemana": 3, "ordenEnDia": 1},
    {"codigo": "X2", "diaSemana": 3, "ordenEnDia": 2},
    {"codigo": "X3", "diaSemana": 3, "ordenEnDia": 3},
    {"codigo": "X4", "diaSemana": 3, "ordenEnDia": 4},
    {"codigo": "X5", "diaSemana": 3, "ordenEnDia": 5},
    {"codigo": "X6", "diaSemana": 3, "ordenEnDia": 6},
    {"codigo": "J1", "diaSemana": 4, "ordenEnDia": 1},
    {"codigo": "J2", "diaSemana": 4, "ordenEnDia": 2},
    {"codigo": "J3", "diaSemana": 4, "ordenEnDia": 3},
    {"codigo": "J4", "diaSemana": 4, "ordenEnDia": 4},
    {"codigo": "J5", "diaSemana": 4, "ordenEnDia": 5},
    {"codigo": "J6", "diaSemana": 4, "ordenEnDia": 6},
    {"codigo": "V1", "diaSemana": 5, "ordenEnDia": 1},
    {"codigo": "V2", "diaSemana": 5, "ordenEnDia": 2},
    {"codigo": "V3", "diaSemana": 5, "ordenEnDia": 3},
    {"codigo": "V4", "diaSemana": 5, "ordenEnDia": 4},
    {"codigo": "V5", "diaSemana": 5, "ordenEnDia": 5},
    {"codigo": "V6", "diaSemana": 5, "ordenEnDia": 6}
  ],
  "aulas": [
    {"codigo": "A5",  "nombre": "Aula 5 (referencia 1A)"},
    {"codigo": "A3",  "nombre": "Aula 3 (referencia 1C)"},
    {"codigo": "A17", "nombre": "Aula 17"},
    {"codigo": "A11", "nombre": "Aula 11 (referencia 1B)"},
    {"codigo": "C00", "nombre": "Aula C00"},
    {"codigo": "A14", "nombre": "Aula 14 (referencia 1D)"},
    {"codigo": "A99", "nombre": "Aula testigo aislada (Mate)"}
  ],
  "asignaturas": [
    {"codigo": "Relig", "nombre": "Religion y Moral Catolica"},
    {"codigo": "ATED",  "nombre": "Atencion Educativa"},
    {"codigo": "Mat",   "nombre": "Matematicas"}
  ],
  "profesores": [
    {"codigo": "REL1", "nombre": "Rivas Prieto, Carmen"},
    {"codigo": "ING6", "nombre": "Jimenez Morgaz, Elena Maria"},
    {"codigo": "GH5",  "nombre": "Lopez Escudero, Raquel"},
    {"codigo": "GH2",  "nombre": "Torres Cubillo, Mariano"},
    {"codigo": "FRA1", "nombre": "Pino Travieso, Soraya de"},
    {"codigo": "MAT8", "nombre": "Campanario Canales, Fco."}
  ],
  "grupos": [
    {"codigo": "1A", "tipo": "ORDINARIO", "grupoPadre": null},
    {"codigo": "1B", "tipo": "ORDINARIO", "grupoPadre": null},
    {"codigo": "1C", "tipo": "ORDINARIO", "grupoPadre": null},
    {"codigo": "1D", "tipo": "ORDINARIO", "grupoPadre": null}
  ],
  "subgrupos": [
    {"codigo": "1A-Rel",      "grupos": ["1A"]},
    {"codigo": "1A-ATED",     "grupos": ["1A"]},
    {"codigo": "1A-Completo", "grupos": ["1A"]},
    {"codigo": "1B-Rel",      "grupos": ["1B"]},
    {"codigo": "1B-ATED",     "grupos": ["1B"]},
    {"codigo": "1B-Completo", "grupos": ["1B"]},
    {"codigo": "1C-Rel",      "grupos": ["1C"]},
    {"codigo": "1C-ATED",     "grupos": ["1C"]},
    {"codigo": "1C-Completo", "grupos": ["1C"]},
    {"codigo": "1D-Rel",      "grupos": ["1D"]},
    {"codigo": "1D-ATED",     "grupos": ["1D"]},
    {"codigo": "1D-Completo", "grupos": ["1D"]}
  ],
  "actividades": [
    {
      "codigo": "Relig_ATED-1AB", "asignatura": null,
      "repeticionesPorSemana": 1, "duracionTramos": 1, "patronTemporal": "NEUTRA",
      "plazas": [
        {"codigo": "Rel-AB",  "asignatura": "Relig", "profesores": ["REL1"],
         "aulaFija": "A5",  "subgrupos": ["1A-Rel", "1B-Rel"]},
        {"codigo": "ATED-A",  "asignatura": "ATED",  "profesores": ["ING6"],
         "aulaFija": "A17", "subgrupos": ["1A-ATED"]},
        {"codigo": "ATED-B",  "asignatura": "ATED",  "profesores": ["GH5"],
         "aulaFija": "A11", "subgrupos": ["1B-ATED"]}
      ]
    },
    {
      "codigo": "Relig_ATED-1CD", "asignatura": null,
      "repeticionesPorSemana": 1, "duracionTramos": 1, "patronTemporal": "NEUTRA",
      "plazas": [
        {"codigo": "Rel-CD",  "asignatura": "Relig", "profesores": ["REL1"],
         "aulaFija": "A3",  "subgrupos": ["1C-Rel", "1D-Rel"]},
        {"codigo": "ATED-C",  "asignatura": "ATED",  "profesores": ["GH2"],
         "aulaFija": "C00", "subgrupos": ["1C-ATED"]},
        {"codigo": "ATED-D",  "asignatura": "ATED",  "profesores": ["FRA1"],
         "aulaFija": "A14", "subgrupos": ["1D-ATED"]}
      ]
    },
    {
      "codigo": "Mat-1A", "asignatura": "Mat",
      "repeticionesPorSemana": 4, "duracionTramos": 1, "patronTemporal": "DISTRIBUIDA",
      "plazas": [
        {"codigo": "Mat-1A-P1", "asignatura": "Mat", "profesores": ["MAT8"],
         "aulaFija": "A99", "subgrupos": ["1A-Completo"]}
      ]
    },
    {
      "codigo": "Mat-1B", "asignatura": "Mat",
      "repeticionesPorSemana": 4, "duracionTramos": 1, "patronTemporal": "DISTRIBUIDA",
      "plazas": [
        {"codigo": "Mat-1B-P1", "asignatura": "Mat", "profesores": ["MAT8"],
         "aulaFija": "A99", "subgrupos": ["1B-Completo"]}
      ]
    },
    {
      "codigo": "Mat-1C", "asignatura": "Mat",
      "repeticionesPorSemana": 4, "duracionTramos": 1, "patronTemporal": "DISTRIBUIDA",
      "plazas": [
        {"codigo": "Mat-1C-P1", "asignatura": "Mat", "profesores": ["MAT8"],
         "aulaFija": "A99", "subgrupos": ["1C-Completo"]}
      ]
    },
    {
      "codigo": "Mat-1D", "asignatura": "Mat",
      "repeticionesPorSemana": 4, "duracionTramos": 1, "patronTemporal": "DISTRIBUIDA",
      "plazas": [
        {"codigo": "Mat-1D-P1", "asignatura": "Mat", "profesores": ["MAT8"],
         "aulaFija": "A99", "subgrupos": ["1D-Completo"]}
      ]
    }
  ]
}
