{
  "tramos": [
    {"codigo": "D1-1", "diaSemana": 1, "ordenEnDia": 1}
  ],
  "aulas": [
    {"codigo": "A5", "nombre": "Aula 5"},
    {"codigo": "A6", "nombre": "Aula 6"}
  ],
  "asignaturas": [
    {"codigo": "CyR", "nombre": "Computacion y Robotica"}
  ],
  "profesores": [
    {"codigo": "P1", "nombre": "Profesor 1"},
    {"codigo": "P2", "nombre": "Profesor 2"}
  ],
  "grupos": [
    {"codigo": "1A", "tipo": "ORDINARIO", "grupoPadre": null}
  ],
  "subgrupos": [
    {"codigo": "1A-Sub1", "grupos": ["1A"]},
    {"codigo": "1A-Sub2", "grupos": ["1A"]}
  ],
  "actividades": [
    {
      "codigo": "CyR-1A", "asignatura": "CyR",
      "repeticionesPorSemana": 1, "duracionTramos": 1, "patronTemporal": "NEUTRA",
      "plazas": [
        {"codigo": "CyR-1A-Fija", "asignatura": "CyR", "profesores": ["P1"],
         "aulaFija": "A5", "subgrupos": ["1A-Sub1"]},
        {"codigo": "CyR-1A-Cand", "asignatura": "CyR", "profesores": ["P2"],
         "aulasCandidatas": ["A5", "A6"], "subgrupos": ["1A-Sub2"]}
      ]
    }
  ]
}
